{
  "$schema": "../schema/golden.schema.json",
  "subject": "aurora",
  "kind": "failing",
  "alignment": {
    "axeCore": "4.14.0",
    "a11yRules": "b79ba2f",
    "liquidPatch": "551b200"
  },
  "findings": [
    {
      "id": "html-lang",
      "ruleId": "html-has-lang",
      "engine": "axe",
      "outcome": "violation",
      "impact": "serious",
      "criteria": ["3.1.1"],
      "category": "document-language",
      "description": "The layout's <html> element has no lang attribute, so screen readers guess the page language.",
      "occurrences": [
        {
          "page": "*",
          "selector": "html"
        }
      ],
      "mapping": "deterministic",
      "span": {
        "kind": "element",
        "file": "layout/theme.liquid",
        "start": 16,
        "tag": "html",
        "anchor": "<html class=\"no-js\">"
      },
      "expectedFix": {
        "channel": "theme-patch",
        "recipe": "document-language",
        "outcome": "fixed",
        "targeted": true
      }
    },
    {
      "id": "announcement-contrast",
      "ruleId": "color-contrast",
      "engine": "axe",
      "outcome": "violation",
      "impact": "serious",
      "criteria": ["1.4.3"],
      "category": "low-contrast",
      "description": "Announcement text uses the global announcement text colour (#9b9b9b) on #f4f1ec, about 2.5:1 at 14px.",
      "occurrences": [
        {
          "page": "*",
          "selector": ".announcement-bar__message"
        }
      ],
      "mapping": "deterministic",
      "span": {
        "kind": "json-value",
        "file": "config/settings_data.json",
        "pointer": "/current/color_announcement_text",
        "start": 143,
        "end": 152
      },
      "rendersFrom": {
        "kind": "element",
        "file": "sections/announcement-bar.liquid",
        "start": 256,
        "tag": "p",
        "anchor": "<p class=\"announcement-bar__message\">{{ section.settings.text | escape }}</p>\n      </a>"
      },
      "expectedFix": {
        "channel": "theme-patch",
        "recipe": "contrast",
        "outcome": "fixed",
        "targeted": true,
        "params": {
          "minimumRatio": 4.5,
          "against": "/current/color_announcement_background"
        },
        "note": "Smallest OKLCH lightness change of the setting that reaches 4.5:1, hue and chroma kept (PLAN §12)."
      }
    },
    {
      "id": "featured-description-contrast",
      "ruleId": "color-contrast",
      "engine": "axe",
      "outcome": "violation",
      "impact": "serious",
      "criteria": ["1.4.3"],
      "category": "low-contrast",
      "description": "The featured collection description takes its colour (#a0a0a0) from a section setting in the home page template, about 2.6:1 on white.",
      "occurrences": [
        {
          "page": "index",
          "selector": ".featured-collection__description"
        }
      ],
      "mapping": "deterministic",
      "span": {
        "kind": "json-value",
        "file": "templates/index.json",
        "pointer": "/sections/featured/settings/description_color",
        "start": 504,
        "end": 513
      },
      "rendersFrom": {
        "kind": "element",
        "file": "sections/featured-collection.liquid",
        "start": 294,
        "tag": "p",
        "anchor": "<p class=\"featured-collection__description\""
      },
      "expectedFix": {
        "channel": "theme-patch",
        "recipe": "contrast",
        "outcome": "fixed",
        "targeted": true,
        "params": {
          "minimumRatio": 4.5
        },
        "note": "The colour is a section setting stored in the JSON template, not a global setting."
      }
    },
    {
      "id": "banner-image-alt",
      "ruleId": "image-alt",
      "engine": "axe",
      "outcome": "violation",
      "impact": "critical",
      "criteria": ["1.1.1"],
      "category": "alt-text-theme-image",
      "description": "The image banner prints the merchant's image with no alt attribute.",
      "occurrences": [
        {
          "page": "index",
          "selector": ".banner__image"
        }
      ],
      "mapping": "deterministic",
      "span": {
        "kind": "element",
        "file": "sections/image-banner.liquid",
        "start": 104,
        "tag": "img",
        "anchor": "<img\n        src=\"{{ section.settings.image | image_url: width: 1600 }}\""
      },
      "expectedFix": {
        "channel": "theme-patch",
        "recipe": "image-alt",
        "outcome": "fixed",
        "targeted": true,
        "note": "alt=\"{{ section.settings.image.alt | escape }}\" from the image object in src."
      }
    },
    {
      "id": "newsletter-email-label",
      "ruleId": "label",
      "engine": "axe",
      "outcome": "violation",
      "impact": "critical",
      "criteria": ["4.1.2"],
      "category": "form-label",
      "description": "The footer newsletter email field has no label, placeholder or accessible name.",
      "occurrences": [
        {
          "page": "*",
          "selector": ".footer__newsletter input[type=\"email\"]"
        }
      ],
      "mapping": "deterministic",
      "span": {
        "kind": "element",
        "file": "sections/footer.liquid",
        "start": 775,
        "tag": "input",
        "anchor": "<input\n            id=\"NewsletterForm-{{ section.id }}\""
      },
      "expectedFix": {
        "channel": "theme-patch",
        "recipe": "form-label",
        "outcome": "fixed",
        "targeted": true,
        "params": {
          "label": {
            "key": "newsletter.label",
            "text": "Email"
          }
        }
      }
    },
    {
      "id": "account-link-name",
      "ruleId": "link-name",
      "engine": "axe",
      "outcome": "violation",
      "impact": "serious",
      "criteria": ["2.4.4", "4.1.2"],
      "category": "empty-link",
      "description": "The account icon link holds only an inline SVG hidden from assistive technology.",
      "occurrences": [
        {
          "page": "*",
          "selector": ".header__icon--account"
        }
      ],
      "mapping": "deterministic",
      "span": {
        "kind": "element",
        "file": "sections/header.liquid",
        "start": 876,
        "tag": "a",
        "anchor": "<a href=\"{{ routes.account_login_url }}\" class=\"header__icon header__icon--account\">"
      },
      "expectedFix": {
        "channel": "theme-patch",
        "recipe": "empty-link",
        "outcome": "fixed",
        "targeted": true,
        "params": {
          "label": {
            "key": "customer.account_fallback",
            "text": "Account"
          }
        }
      }
    },
    {
      "id": "cart-link-name",
      "ruleId": "link-name",
      "engine": "axe",
      "outcome": "violation",
      "impact": "serious",
      "criteria": ["2.4.4", "4.1.2"],
      "category": "empty-link",
      "description": "The cart icon link holds an icon snippet and a count bubble marked aria-hidden, so it has no name.",
      "occurrences": [
        {
          "page": "*",
          "selector": "#cart-icon-bubble"
        }
      ],
      "mapping": "deterministic",
      "span": {
        "kind": "element",
        "file": "sections/header.liquid",
        "start": 1303,
        "tag": "a",
        "anchor": "<a href=\"{{ routes.cart_url }}\" class=\"header__icon header__icon--cart\" id=\"cart-icon-bubble\">"
      },
      "expectedFix": {
        "channel": "theme-patch",
        "recipe": "empty-link",
        "outcome": "fixed",
        "targeted": true,
        "params": {
          "label": {
            "key": "templates.cart.cart",
            "text": "Cart"
          }
        }
      }
    },
    {
      "id": "menu-toggle-name",
      "ruleId": "button-name",
      "engine": "axe",
      "outcome": "violation",
      "impact": "critical",
      "criteria": ["4.1.2"],
      "category": "empty-button",
      "description": "The menu toggle button holds only the hamburger icon snippet.",
      "occurrences": [
        {
          "page": "*",
          "selector": ".header__menu-toggle"
        }
      ],
      "mapping": "deterministic",
      "span": {
        "kind": "element",
        "file": "sections/header.liquid",
        "start": 37,
        "tag": "button",
        "anchor": "<button class=\"header__menu-toggle\" type=\"button\" aria-controls=\"HeaderMenu\" aria-expanded=\"false\">"
      },
      "expectedFix": {
        "channel": "theme-patch",
        "recipe": "empty-button",
        "outcome": "fixed",
        "targeted": true,
        "params": {
          "label": {
            "key": "sections.header.menu",
            "text": "Menu"
          }
        }
      }
    },
    {
      "id": "social-facebook-name",
      "ruleId": "link-name",
      "engine": "axe",
      "outcome": "violation",
      "impact": "serious",
      "criteria": ["2.4.4", "4.1.2"],
      "category": "empty-link",
      "description": "The Facebook link in the footer holds only an icon snippet.",
      "occurrences": [
        {
          "page": "*",
          "selector": ".list-social__link[href*=\"facebook\"]"
        }
      ],
      "mapping": "deterministic",
      "span": {
        "kind": "element",
        "file": "sections/footer.liquid",
        "start": 1512,
        "tag": "a",
        "anchor": "<a href=\"{{ settings.social_facebook_link }}\" class=\"list-social__link\">"
      },
      "expectedFix": {
        "channel": "theme-patch",
        "recipe": "empty-link",
        "outcome": "fixed",
        "targeted": true,
        "params": {
          "label": {
            "key": "general.social.links.facebook",
            "text": "Facebook"
          }
        }
      }
    },
    {
      "id": "social-instagram-name",
      "ruleId": "link-name",
      "engine": "axe",
      "outcome": "violation",
      "impact": "serious",
      "criteria": ["2.4.4", "4.1.2"],
      "category": "empty-link",